ID;Name;Rarity;Top Shelf Courses
g_8_bit_1_up_mushroom;8-Bit 1-Up Mushroom;HighEnd;3DS Cheep Cheep Lagoon, 3DS Piranha Plant Slide, 3DS Piranha Plant Slide R (Lvl 8), Athens Dash, Berlin Byways R, DS Mario Circuit, DS Peach Gardens, DS Peach Gardens R, DS Shroom Ridge R, GBA Battle Course 1, GBA Bowser's Castle 3, GBA Bowser's Castle 3R, GBA Bowser's Castle 4, GBA Peach Circuit R/T, GBA Riverside Park T, GBA Sky Garden (Lvl 6), GBA Sky Garden R, GCN Daisy Cruiser R, London Loop T, Madrid Drive 3R/T, Madrid Drive T, Merry Mountain R/T, New York Minute 3R/T, New York Minute T, Piranha Plant Cove, Piranha Plant Pipeline R/T, RMX Donut Plains 1, RMX Rainbow Road 1R (Lvl 3), Singapore Speedway 3R/T, Sky-High Sundae, SNES Choco Island 1R/T, SNES Choco Island 2 (Lvl 3), SNES Choco Island 2R, SNES Donut Plains 2, SNES Donut Plains 3T, SNES Ghost Valley 1R/T (Lvl 6), SNES Ghost Valley 2T, SNES Mario Circuit 2R/T, SNES Rainbow Road R/T, SNES Vanilla Lake 1, Squeaky Clean Sprint T, Sydney Sprint 2, Sydney Sprint 3, Tokyo Blur 3R/T, Vancouver Velocity 3R, Wii Dry Dry Ruins, Wii Koopa Cape R/T, Wii Moonview Highway R/T, Yoshi's Island R/T
g_8_bit_block_glider;8-Bit Block Glider;HighEnd;3DS Bowser's Castle R, 3DS Daisy Hills, 3DS Wario Shipyard, Athens Dash 2, Athens Dash R/T, Berlin Byways 3R/T, Berlin Byways T, DS DK Pass R/T, DS Mario Circuit T (Lvl 8), DS Peach Gardens T, GBA Bowser's Castle 3R, GBA Lakeside Park, GBA Yoshi Desert R/T, GCN Mushroom Bridge, London Loop R/T, Madrid Drive T, N64 Luigi Raceway R/T, N64 Mario Raceway R/T, New York Minute 2, New York Minute R, Piranha Plant Cove, Piranha Plant Cove 2, Piranha Plant Cove 3, Piranha Plant Cove 3R, RMX Bowser's Castle 1R/T, RMX Mario Circuit 1R/T (Lvl 3), RMX Mario Circuit 1T, RMX Vanilla Lake 2R/T, Rome Avanti 2T, Rome Avanti 3, Rome Avanti T, SNES Bowser Castle 3R, SNES Choco Island 1R, SNES Donut Plains 1R/T, SNES Donut Plains 2R/T, SNES Donut Plains 3R/T (Lvl 6), SNES Donut Plains 3T, SNES Koopa Troopa Beach 2T, SNES Mario Circuit 1, SNES Mario Circuit 1R (Lvl 3), SNES Mario Circuit 1R/T (Lvl 6), Squeaky Clean Sprint, Sydney Sprint 3R, Tokyo Blur 3R, Wii Coconut Mall R, Wii Daisy Circuit R/T, Wii DK Summit R, Wii Dry Dry Ruins, Wii Dry Dry Ruins R
g_8_bit_bullet_bill;8-Bit Bullet Bill;HighEnd;3DS Neo Bowser City, 3DS Rock Rock Mountain R, Athens Dash 2, Athens Dash 3T, Bangkok Rush 3, Bangkok Rush 3R/T, Berlin Byways T, DS Airship Fortress, DS Airship Fortress R (Lvl 3), DS Airship Fortress R/T, DS Airship Fortress T, DS Waluigi Pinball R/T, GBA Battle Course 1, GBA Bowser's Castle 1R, GBA Bowser's Castle 1T, GBA Bowser's Castle 2R (Lvl 6), GBA Bowser's Castle 2R/T, GBA Bowser's Castle 2T, GBA Bowser's Castle 4, GBA Cheep-Cheep Island T, GBA Sky Garden T, GBA Yoshi Desert R/T, GCN Daisy Cruiser R, GCN Mushroom Bridge T, GCN Waluigi Stadium R, N64 Choco Mountain R/T, N64 Kalimari Desert R, N64 Yoshi Valley T, New York Minute 4R/T, Ninja Hideaway R/T, Piranha Plant Cove 3R, RMX Choco Island 2, RMX Choco Island 2R, RMX Choco Island 2R/T, RMX Ghost Valley 1 (Lvl 8), RMX Ghost Valley 1R, Rome Avanti 3, SNES Ghost Valley 1, SNES Mario Circuit 3R, SNES Mario Circuit 3R/T (Lvl 6), SNES Vanilla Lake 1T, Sydney Sprint 2T, Wii Maple Treeway (Lvl 3)
g_8_bit_fire_flower;8-Bit Fire Flower;HighEnd;3DS Bowser's Castle, 3DS Mario Circuit R, 3DS Piranha Plant Slide T, 3DS Rainbow Road, Amsterdam Drift T, Athens Dash 3T, DS Twilight House, GBA Bowser's Castle 1R/T, GBA Bowser's Castle 1T, GBA Bowser's Castle 3T, GBA Cheep-Cheep Island, GCN DK Mountain, Los Angeles Laps 2, Madrid Drive 3, Madrid Drive R/T, Ninja Hideaway T, RMX Choco Island 1R/T, RMX Ghost Valley 1, RMX Ghost Valley 1R, RMX Mario Circuit 1T (Lvl 3), RMX Rainbow Road 2 (Lvl 8), RMX Rainbow Road 2R/T, Singapore Speedway 2R, SNES Choco Island 1T, SNES Donut Plains 2R/T, SNES Ghost Valley 1 (Lvl 3), SNES Ghost Valley 2T, SNES Mario Circuit 1R (Lvl 6), SNES Mario Circuit 2, SNES Mario Circuit 2T, SNES Mario Circuit 3, SNES Mario Circuit 3R/T, SNES Rainbow Road R/T, SNES Vanilla Lake 1, SNES Vanilla Lake 1R/T, SNES Vanilla Lake 1T, Sydney Sprint 2R, Sydney Sprint T, Tokyo Blur 3R/T, Tokyo Blur 4, Tokyo Blur 4R/T (Lvl 6), Tokyo Blur 4T, Vancouver Velocity 2T, Wii Koopa Cape T, Wii Maple Treeway R/T
g_8_bit_goomba;8-Bit Goomba;HighEnd;3DS Bowser's Castle T, 3DS Cheep Cheep Lagoon R, 3DS Piranha Plant Slide T, Amsterdam Drift 2R/T, Athens Dash 2R/T, Athens Dash 3, Athens Dash R, DS Mario Circuit, DS Mario Circuit R (Lvl 6), DS Shroom Ridge R, DS Twilight House, GBA Bowser's Castle 1, GBA Bowser's Castle 3, GBA Lakeside Park, GBA Luigi Circuit T, GBA Yoshi Desert, GCN Mushroom Bridge T, GCN Waluigi Stadium, Los Angeles Laps 3R/T, Madrid Drive R/T, N64 Koopa Troopa Beach R, New York Minute, RMX Choco Island 1, RMX Choco Island 2R, RMX Donut Plains 1R/T, RMX Donut Plains 1T (Lvl 6), RMX Ghost Valley 1R, RMX Mario Circuit 1, RMX Mario Circuit 1R/T (Lvl 3), RMX Mario Circuit 1T (Lvl 3), RMX Vanilla Lake 1R/T, RMX Vanilla Lake 2T, Rome Avanti 2R/T, SNES Bowser Castle 3, SNES Bowser Castle 3T, SNES Donut Plains 1R, SNES Donut Plains 2R/T, SNES Donut Plains 3R (Lvl 8), SNES Donut Plains 3R/T, SNES Koopa Troopa Beach 2R/T, Squeaky Clean Sprint T, Sydney Sprint 3, Tokyo Blur 2R/T, Tokyo Blur 3R, Wii Dry Dry Ruins R, Wii Dry Dry Ruins R/T
g_8_bit_jumping_luigi;8-Bit Jumping Luigi;Super;DS Luigi's Mansion R/T (Lvl 6), DS Waluigi Pinball R/T (Lvl 3), GBA Battle Course 1, N64 Frappe Snowland, N64 Luigi Raceway, New York Minute 2, RMX Rainbow Road 1R, Singapore Speedway 2T, SNES Donut Plains 2, SNES Mario Circuit 1R/T, SNES Mario Circuit 2T, SNES Mario Circuit 3R, SNES Mario Circuit 3R/T
g_8_bit_jumping_mario;8-Bit Jumping Mario;Super;GBA Bowser's Castle 2R, London Loop, N64 Luigi Raceway, RMX Mario Circuit 1, RMX Mario Circuit 1R/T, RMX Mario Circuit 1T, SNES Donut Plains 3, SNES Mario Circuit 1, SNES Mario Circuit 1R, SNES Mario Circuit 1R/T (Lvl 3), SNES Mario Circuit 2 (Lvl 6), SNES Mario Circuit 2R, SNES Mario Circuit 2R/T
g_8_bit_star;8-Bit Star;HighEnd;3DS Rainbow Road, 3DS Rainbow Road T (Lvl 3), 3DS Rosalina's Ice World, 3DS Wario Shipyard, Berlin Byways 2, DS DK Pass R (Lvl 3), DS DK Pass T, GBA Sunset Wilds R, Los Angeles Laps R, New York Minute 2R, RMX Choco Island 1R/T, RMX Mario Circuit 1 (Lvl 6), RMX Mario Circuit 1R/T, RMX Mario Circuit 1T (Lvl 6), RMX Rainbow Road 1, RMX Rainbow Road 1R/T, RMX Rainbow Road 1T, RMX Rainbow Road 2, Rome Avanti 3R/T, SNES Choco Island 1, SNES Choco Island 2 (Lvl 8), SNES Choco Island 2R, SNES Mario Circuit 3T, SNES Rainbow Road R, SNES Rainbow Road T, Sydney Sprint R/T
g_8_bit_super_glider;8-Bit Super Glider;HighEnd;3DS Bowser's Castle, 3DS Daisy Hills, 3DS Piranha Plant Slide, 3DS Piranha Plant Slide R, 3DS Wario Shipyard R/T, Amsterdam Drift 2R, Athens Dash, Athens Dash 2R/T, Berlin Byways 3R/T, DS Airship Fortress, DS Mario Circuit, DS Mario Circuit R/T (Lvl 8), DS Shroom Ridge R/T, GBA Bowser's Castle 4, GBA Lakeside Park T, GBA Peach Circuit T, GBA Sky Garden, GBA Snow Land R, GBA Yoshi Desert T, GCN Baby Park R/T, GCN Daisy Cruiser T, GCN Mushroom Bridge T, London Loop 3T, London Loop R, Los Angeles Laps 2T, Madrid Drive 2R/T, Madrid Drive 3, N64 Koopa Troopa Beach, N64 Luigi Raceway (Lvl 6), N64 Luigi Raceway R, N64 Mario Raceway, New York Minute R/T, Ninja Hideaway R/T, Piranha Plant Cove 3T, Piranha Plant Pipeline, RMX Vanilla Lake 1T, RMX Vanilla Lake 2T, Singapore Speedway 2T, Singapore Speedway T, Sky-High Sundae, SNES Bowser Castle 3T, SNES Donut Plains 3R (Lvl 6), SNES Mario Circuit 2, SNES Mario Circuit 2R (Lvl 3), SNES Mario Circuit 3R, SNES Mario Circuit 3R/T (Lvl 3), Squeaky Clean Sprint T, Wii Coconut Mall T, Wii DK Summit R/T, Wii Maple Treeway R, Wii Moonview Highway, Wii Moonview Highway T, Yoshi's Island R
g_8_bit_super_mushroom;8-Bit Super Mushroom;HighEnd;3DS Mario Circuit R, 3DS Mario Circuit R/T (Lvl 3), 3DS Toad Circuit, 3DS Toad Circuit R/T, 3DS Wario Shipyard T, Amsterdam Drift R/T, Athens Dash, Bangkok Rush 2T, Bangkok Rush R, DS Mario Circuit R/T, DS Shroom Ridge, GBA Bowser's Castle 4R, GBA Sky Garden, GBA Snow Land T, GCN Daisy Cruiser, GCN Yoshi Circuit R/T (Lvl 6), Madrid Drive 2, Madrid Drive 3R/T, Madrid Drive T, N64 Royal Raceway (Lvl 8), N64 Royal Raceway R/T, N64 Royal Raceway T, Paris Promenade 3, Piranha Plant Cove 2R, Piranha Plant Pipeline, RMX Choco Island 2R, RMX Ghost Valley 1R/T (Lvl 6), RMX Rainbow Road 1R/T, RMX Vanilla Lake 2, Rome Avanti 3R, Singapore Speedway R/T, SNES Bowser Castle 3T, SNES Choco Island 1R/T, SNES Donut Plains 1R/T (Lvl 3), SNES Donut Plains 2R, SNES Koopa Troopa Beach 2R, SNES Koopa Troopa Beach 2T, SNES Mario Circuit 1R/T, SNES Mario Circuit 1T, SNES Mario Circuit 2R, SNES Mario Circuit 2T, SNES Mario Circuit 3R/T, SNES Mario Circuit 3T, SNES Rainbow Road T, Squeaky Clean Sprint T, Wii Dry Dry Ruins R/T, Wii Mushroom Gorge R/T, Wii Mushroom Gorge T
g_block;? Block;Super;3DS Toad Circuit, 3DS Toad Circuit R/T (Lvl 6), 3DS Toad Circuit T, GBA Bowser's Castle 1R/T, GBA Bowser's Castle 2T, GCN Yoshi Circuit R/T, London Loop 2R, N64 Frappe Snowland T, RMX Mario Circuit 1R, RMX Rainbow Road 1R, Rome Avanti, SNES Koopa Troopa Beach 2R (Lvl 3), SNES Mario Circuit 3T
g_aurora_balloons;Aurora Balloons;HighEnd;3DS Wario Shipyard T, Berlin Byways 2, Berlin Byways 2R, Berlin Byways R, DS DK Pass R, DS DK Pass R/T, GBA Luigi Circuit R, GBA Sky Garden R, GBA Sky Garden T, Los Angeles Laps 2R, Merry Mountain, N64 Frappe Snowland, N64 Koopa Troopa Beach (Lvl 6), N64 Koopa Troopa Beach R (Lvl 3), N64 Royal Raceway R/T, N64 Yoshi Valley, RMX Rainbow Road 1R/T, RMX Vanilla Lake 1, RMX Vanilla Lake 2R/T, Rome Avanti R/T, Singapore Speedway T, Sky-High Sundae T, SNES Choco Island 2R/T, SNES Donut Plains 3R/T, SNES Vanilla Lake 1R, SNES Vanilla Lake 1T (Lvl 8), SNES Vanilla Lake 2 (Lvl 6), SNES Vanilla Lake 2R, SNES Vanilla Lake 2T (Lvl 3), Squeaky Clean Sprint, Vancouver Velocity, Vancouver Velocity 2, Vancouver Velocity 3, Vancouver Velocity 3T, Wii Coconut Mall, Wii DK Summit, Wii Koopa Cape T, Wii Rainbow Road R/T
g_autumn_leaves;Autumn Leaves;HighEnd;3DS Cheep Cheep Lagoon T, 3DS Daisy Hills, 3DS Daisy Hills R/T, 3DS Rock Rock Mountain R (Lvl 3), 3DS Rock Rock Mountain T, 3DS Toad Circuit T, Amsterdam Drift R/T, Athens Dash 2, Bangkok Rush 2R/T, Bangkok Rush 3T, DS Peach Gardens T, GBA Bowser's Castle 4R, GBA Cheep-Cheep Island R, GBA Cheep-Cheep Island R/T, GBA Riverside Park R (Lvl 8), GBA Riverside Park R/T, GBA Sunset Wilds R, GCN Dino Dino Jungle R, GCN DK Mountain R/T, London Loop, Los Angeles Laps 3T, Madrid Drive R/T, N64 Choco Mountain T (Lvl 3), N64 Frappe Snowland R/T, N64 Kalimari Desert 2, N64 Mario Raceway R/T, N64 Mario Raceway T, N64 Yoshi Valley, N64 Yoshi Valley T (Lvl 6), Paris Promenade 2, Paris Promenade 3T, Rome Avanti R, SNES Bowser Castle 3R/T, SNES Donut Plains 3R/T, SNES Mario Circuit 1, SNES Mario Circuit 2, Tokyo Blur 3R, Tokyo Blur 4T, Vancouver Velocity 2R, Vancouver Velocity 3R, Wii Daisy Circuit R/T, Wii Daisy Circuit T, Wii Dry Dry Ruins, Wii Koopa Cape R, Wii Maple Treeway R/T, Wii Maple Treeway T, Wii Mushroom Gorge R/T, Wii Mushroom Gorge T (Lvl 6), Yoshi's Island T
g_bbia_parafoil;BBIA Parafoil;Normal;3DS Daisy Hills, 3DS Daisy Hills R/T (Lvl 6), 3DS Shy Guy Bazaar R, SNES Mario Circuit 1T, SNES Rainbow Road T
g_banana_parafoil;BaNaNa Parafoil;Super;3DS Daisy Hills R/T, DS Waluigi Pinball T, GBA Bowser's Castle 2R, GCN Dino Dino Jungle R/T, London Loop R, SNES Choco Island 1, SNES Choco Island 2 (Lvl 3), SNES Choco Island 2R/T, SNES Ghost Valley 1R, SNES Mario Circuit 3 (Lvl 6), SNES Mario Circuit 3R, SNES Vanilla Lake 1R
g_baby_mario_hanafuda;Baby Mario Hanafuda;HighEnd;3DS Rainbow Road, 3DS Rainbow Road R, 3DS Rainbow Road T, DS DK Pass R/T (Lvl 8), DS Luigi's Mansion R/T, GCN Dino Dino Jungle R/T (Lvl 3), N64 Choco Mountain T (Lvl 6), RMX Mario Circuit 1R/T, SNES Donut Plains 1 (Lvl 6), SNES Ghost Valley 1, SNES Ghost Valley 1R, SNES Ghost Valley 1R/T (Lvl 3), SNES Ghost Valley 1T
g_banana_wingtip;Banana Wingtip;HighEnd;3DS Cheep Cheep Lagoon T, 3DS Toad Circuit (Lvl 6), 3DS Toad Circuit R/T, Bangkok Rush T, GCN Dino Dino Jungle T (Lvl 3), Los Angeles Laps R/T, Los Angeles Laps T, N64 Choco Mountain (Lvl 6), N64 Choco Mountain R, N64 Kalimari Desert R/T, N64 Koopa Troopa Beach T, New York Minute B, Paris Promenade 2T, RMX Ghost Valley 1T (Lvl 8), Rome Avanti, SNES Choco Island 1R, SNES Choco Island 2R/T, SNES Donut Plains 3R/T, SNES Mario Circuit 1 (Lvl 3), SNES Mario Circuit 1R, Tokyo Blur 3T, Wii Coconut Mall
g_barrel_hanafuda;Barrel Hanafuda;HighEnd;3DS Daisy Hills R/T, 3DS Neo Bowser City, 3DS Neo Bowser City R, 3DS Neo Bowser City T, 3DS Shy Guy Bazaar R (Lvl 3), DS Luigi's Mansion (Lvl 8), DS Luigi's Mansion R (Lvl 6), GBA Bowser's Castle 1, GBA Bowser's Castle 1R, GBA Bowser's Castle 1R/T, GBA Bowser's Castle 1T, GBA Bowser's Castle 2, GBA Bowser's Castle 2R, GBA Bowser's Castle 2T, GCN Dino Dino Jungle R/T, N64 Kalimari Desert (Lvl 6), N64 Kalimari Desert R/T, N64 Kalimari Desert T (Lvl 3), Rome Avanti 3R/T
g_black_cat_parafoil;Black Cat Parafoil;HighEnd;3DS Bowser's Castle R (Lvl 6), 3DS Bowser's Castle R/T, 3DS Neo Bowser City, 3DS Piranha Plant Slide R/T, 3DS Wario Shipyard, 3DS Wario Shipyard T (Lvl 8), Amsterdam Drift T, Berlin Byways 2T, DS Airship Fortress R/T, DS Twilight House, GBA Lakeside Park T, GBA Sunset Wilds R, GCN Baby Park, GCN Baby Park T, GCN Dino Dino Jungle, GCN Dino Dino Jungle R (Lvl 3), GCN Dino Dino Jungle T, GCN DK Mountain, GCN DK Mountain T, London Loop 2T, Los Angeles Laps 2R, N64 Choco Mountain R/T (Lvl 6), N64 Yoshi Valley R, RMX Bowser's Castle 1, RMX Ghost Valley 1R (Lvl 3), RMX Ghost Valley 1R/T, RMX Ghost Valley 1T, RMX Rainbow Road 2, Rome Avanti 2, Singapore Speedway R/T, SNES Ghost Valley 1, SNES Ghost Valley 1R/T, SNES Ghost Valley 2T, Sydney Sprint, Wii Maple Treeway T
g_black_great_sail;Black Great Sail;HighEnd;3DS Cheep Cheep Lagoon R/T, 3DS Neo Bowser City T, 3DS Rock Rock Mountain T, DS Airship Fortress, DS Airship Fortress R, DS Airship Fortress R/T, DS Airship Fortress T, DS Twilight House, GBA Bowser's Castle 1, GBA Bowser's Castle 2 (Lvl 3), GBA Bowser's Castle 2R, GBA Bowser's Castle 2R/T, GBA Cheep-Cheep Island, GBA Cheep-Cheep Island R, GBA Sunset Wilds R/T (Lvl 6), GCN Yoshi Circuit (Lvl 3), London Loop 2, London Loop 3T, Los Angeles Laps 3T, Ninja Hideaway T, RMX Choco Island 2, RMX Choco Island 2R (Lvl 6), RMX Choco Island 2T, RMX Ghost Valley 1R (Lvl 8), RMX Ghost Valley 1T, RMX Vanilla Lake 1, Singapore Speedway, Singapore Speedway 2T, SNES Choco Island 2R/T, SNES Vanilla Lake 1, SNES Vanilla Lake 1T, Sydney Sprint 2, Sydney Sprint R/T, Wii DK Summit R, Wii Maple Treeway R/T
g_black_starchute;Black Starchute;HighEnd;3DS Bowser's Castle R, 3DS Bowser's Castle R/T, 3DS Neo Bowser City (Lvl 3), 3DS Shy Guy Bazaar R/T, Athens Dash 2, Berlin Byways, Berlin Byways 3R, DS Airship Fortress R/T, GBA Battle Course 1, GBA Boo Lake, GBA Bowser's Castle 1R (Lvl 3), GBA Bowser's Castle 1T, GBA Bowser's Castle 3T (Lvl 8), GBA Bowser's Castle 4, GBA Luigi Circuit, GBA Yoshi Desert, GCN DK Mountain R/T, GCN Waluigi Stadium R, London Loop 2R, London Loop R/T, Merry Mountain R/T, N64 Choco Mountain R, N64 Frappe Snowland R/T, New York Minute 3T, Ninja Hideaway, Piranha Plant Cove 2R/T, Piranha Plant Cove 3R, Piranha Plant Cove R/T, RMX Bowser's Castle 1 (Lvl 6), RMX Bowser's Castle 1R, RMX Bowser's Castle 1T, RMX Choco Island 2R, RMX Choco Island 2R/T, RMX Donut Plains 1R/T, RMX Ghost Valley 1R/T, Rome Avanti 2, Singapore Speedway 2, Singapore Speedway 3R/T, SNES Bowser Castle 3T, SNES Ghost Valley 1R, SNES Ghost Valley 2, Vancouver Velocity 3, Vancouver Velocity 3T, Wii Daisy Circuit T, Wii Moonview Highway, Wii Moonview Highway R/T, Wii Mushroom Gorge (Lvl 6), Wii Mushroom Gorge R, Wii Rainbow Road
g_black_toe_bean_balloons;Black Toe-Bean Balloons;HighEnd;Amsterdam Drift R/T, DS Twilight House, GBA Cheep-Cheep Island, GBA Cheep-Cheep Island R, GCN Dino Dino Jungle R (Lvl 6), GCN Dino Dino Jungle R/T, GCN DK Mountain, GCN DK Mountain R, Los Angeles Laps 3, N64 Choco Mountain R/T, N64 Royal Raceway R/T, Ninja Hideaway R/T, Paris Promenade 2R, Paris Promenade 3, Paris Promenade 3R, Paris Promenade R/T, RMX Choco Island 1, RMX Choco Island 1R, RMX Choco Island 2, RMX Ghost Valley 1T, RMX Vanilla Lake 1T, SNES Choco Island 1R/T, SNES Donut Plains 2, SNES Donut Plains 2R (Lvl 6), SNES Donut Plains 2T (Lvl 3), SNES Ghost Valley 1, SNES Mario Circuit 3R/T, SNES Vanilla Lake 2, SNES Vanilla Lake 2R (Lvl 8), Sydney Sprint 2R, Vancouver Velocity 2T, Wii DK Summit, Wii DK Summit R (Lvl 3), Wii DK Summit T
g_blizzard_balloons;Blizzard Balloons;HighEnd;3DS Mario Circuit R/T, 3DS Neo Bowser City R/T (Lvl 3), 3DS Rainbow Road R/T, 3DS Rosalina's Ice World T, DS Waluigi Pinball R/T, Madrid Drive 3R, N64 Frappe Snowland R/T, N64 Frappe Snowland T, RMX Choco Island 1, RMX Choco Island 1T (Lvl 6), RMX Mario Circuit 1R (Lvl 3), RMX Mario Circuit 1T (Lvl 6), RMX Vanilla Lake 1 (Lvl 8), SNES Donut Plains 1R, SNES Donut Plains 2R, SNES Koopa Troopa Beach 2T, SNES Vanilla Lake 1, SNES Vanilla Lake 1T
g_blizzard_parasol;Blizzard Parasol;HighEnd;3DS Bowser's Castle R, 3DS Neo Bowser City R/T (Lvl 3), DS DK Pass R/T, DS Waluigi Pinball R/T, N64 Frappe Snowland, N64 Frappe Snowland R, N64 Frappe Snowland T (Lvl 6), N64 Royal Raceway, N64 Royal Raceway T, RMX Choco Island 1 (Lvl 6), RMX Mario Circuit 1 (Lvl 8), RMX Mario Circuit 1T, RMX Vanilla Lake 1R, Rome Avanti 3R/T, Sky-High Sundae R/T, SNES Mario Circuit 1R/T, SNES Mario Circuit 1T, SNES Rainbow Road R, SNES Vanilla Lake 1T (Lvl 3), Vancouver Velocity 2, Vancouver Velocity R/T, Wii DK Summit T
g_blooper_hanafuda;Blooper Hanafuda;HighEnd;3DS Cheep Cheep Lagoon (Lvl 6), 3DS Cheep Cheep Lagoon R/T, 3DS Rosalina's Ice World R (Lvl 8), DS DK Pass (Lvl 6), DS DK Pass T (Lvl 3), Madrid Drive 3R, N64 Koopa Troopa Beach, N64 Koopa Troopa Beach R, N64 Koopa Troopa Beach T, SNES Choco Island 2, SNES Choco Island 2R, SNES Choco Island 2T, SNES Mario Circuit 1R/T, SNES Mario Circuit 2R (Lvl 3), SNES Mario Circuit 2R/T, SNES Vanilla Lake 1, SNES Vanilla Lake 1R, SNES Vanilla Lake 1T
g_blooper_wingtip;Blooper Wingtip;HighEnd;3DS Cheep Cheep Lagoon R (Lvl 6), 3DS Cheep Cheep Lagoon T, Berlin Byways 2R/T, Berlin Byways 2T, DS Airship Fortress (Lvl 6), GBA Cheep-Cheep Island R (Lvl 8), GCN Daisy Cruiser R, GCN Yoshi Circuit R/T, Los Angeles Laps R/T, Merry Mountain T, N64 Choco Mountain R, N64 Choco Mountain T, N64 Royal Raceway, RMX Bowser's Castle 1R, SNES Choco Island 1, SNES Choco Island 1T, SNES Choco Island 2R/T, SNES Ghost Valley 1, SNES Koopa Troopa Beach 2R (Lvl 3), SNES Mario Circuit 2, SNES Mario Circuit 2T (Lvl 3), Sydney Sprint 3R/T, Sydney Sprint T, Wii DK Summit
g_blue_flower_glider;Blue Flower Glider;Super;3DS Cheep Cheep Lagoon R, 3DS Cheep Cheep Lagoon R/T, 3DS Neo Bowser City R/T, 3DS Rainbow Road R, DS DK Pass, GCN Dino Dino Jungle R/T (Lvl 3), N64 Frappe Snowland, Paris Promenade B, SNES Rainbow Road R/T (Lvl 6), SNES Vanilla Lake 1T, Vancouver Velocity R
g_bob_omb_parafoil;Bob-omb Parafoil;Super;3DS Rock Rock Mountain R (Lvl 6), 3DS Shy Guy Bazaar T, 3DS Toad Circuit R, GBA Bowser's Castle 1, GCN Dino Dino Jungle, N64 Kalimari Desert R/T (Lvl 3), N64 Koopa Troopa Beach T, RMX Bowser's Castle 1R/T
g_boo_hanafuda;Boo Hanafuda;HighEnd;3DS Shy Guy Bazaar (Lvl 6), 3DS Shy Guy Bazaar R (Lvl 3), 3DS Shy Guy Bazaar R/T, DS Luigi's Mansion, DS Luigi's Mansion R, DS Luigi's Mansion R/T, DS Luigi's Mansion T, GBA Bowser's Castle 1R (Lvl 3), GBA Bowser's Castle 1T (Lvl 8), N64 Kalimari Desert 2, N64 Kalimari Desert 2R, N64 Kalimari Desert 2T, SNES Ghost Valley 1R (Lvl 6), SNES Ghost Valley 1R/T
g_boo_masks;Boo Masks;HighEnd;3DS Bowser's Castle R/T (Lvl 6), 3DS Bowser's Castle T, Athens Dash R/T, Berlin Byways 3, Berlin Byways 3R, Berlin Byways T, GBA Battle Course 1, GBA Boo Lake, GBA Boo Lake T, GBA Bowser's Castle 3R (Lvl 6), GBA Bowser's Castle 3R/T, GBA Sunset Wilds, GCN Daisy Cruiser R, GCN DK Mountain R/T, London Loop T, N64 Frappe Snowland, N64 Luigi Raceway R, N64 Luigi Raceway R/T, N64 Yoshi Valley T, New York Minute 2, New York Minute 2R/T, Piranha Plant Cove 2, Piranha Plant Cove 3T, Piranha Plant Cove R, RMX Bowser's Castle 1, RMX Ghost Valley 1R/T, RMX Vanilla Lake 1, RMX Vanilla Lake 1T, Singapore Speedway 3, Singapore Speedway R, SNES Bowser Castle 3T, SNES Ghost Valley 1R/T, SNES Ghost Valley 2 (Lvl 8), SNES Ghost Valley 2R, SNES Ghost Valley 2R/T, Tokyo Blur R/T, Vancouver Velocity 3R/T, Wii Dry Dry Ruins, Wii Maple Treeway R/T (Lvl 3), Wii Moonview Highway, Wii Mushroom Gorge (Lvl 3), Yoshi's Island R
g_bowser_hanafuda;Bowser Hanafuda;HighEnd;3DS Daisy Hills R (Lvl 6), 3DS Daisy Hills T (Lvl 6), DS Airship Fortress, DS Airship Fortress R, DS Airship Fortress R/T (Lvl 8), DS Airship Fortress T, DS DK Pass R/T, DS Twilight House, RMX Rainbow Road 1, RMX Rainbow Road 1R, RMX Rainbow Road 1R/T, RMX Rainbow Road 1T, SNES Choco Island 1R (Lvl 3), SNES Choco Island 1T (Lvl 3), Wii Maple Treeway, Wii Maple Treeway R, Wii Maple Treeway T
g_bright_balloons;Bright Balloons;HighEnd;Amsterdam Drift 3, Amsterdam Drift R, Bangkok Rush 3R/T, DS Waluigi Pinball R (Lvl 6), GBA Bowser's Castle 4R, GBA Cheep-Cheep Island T, GBA Snow Land, GBA Sunset Wilds, GBA Sunset Wilds R, GBA Sunset Wilds T (Lvl 6), GCN Baby Park R/T, GCN Yoshi Circuit R, London Loop 2, London Loop 3, Los Angeles Laps 3R/T, Madrid Drive 2R/T, Merry Mountain R/T, N64 Choco Mountain R (Lvl 3), N64 Choco Mountain R/T, N64 Luigi Raceway T, N64 Royal Raceway R/T, N64 Yoshi Valley T, New York Minute 4, RMX Choco Island 1, RMX Choco Island 1R/T, RMX Choco Island 2R, RMX Choco Island 2T, RMX Mario Circuit 1 (Lvl 3), RMX Vanilla Lake 1T, RMX Vanilla Lake 2R/T, Singapore Speedway 3, SNES Donut Plains 1, SNES Donut Plains 2R, SNES Donut Plains 2R/T (Lvl 8), SNES Donut Plains 2T, SNES Koopa Troopa Beach 2, Sydney Sprint R/T, Wii Maple Treeway R, Wii Rainbow Road R, Yoshi's Island R
g_bright_glider;Bright Glider;HighEnd;3DS Daisy Hills R/T (Lvl 3), 3DS Mario Circuit R/T (Lvl 3), 3DS Rock Rock Mountain T, DS Luigi's Mansion, DS Luigi's Mansion T, GBA Bowser's Castle 2, GBA Bowser's Castle 2R/T (Lvl 6), GCN Cookie Land, GCN Yoshi Circuit, GCN Yoshi Circuit R/T, London Loop, London Loop R/T, N64 Koopa Troopa Beach R/T, N64 Royal Raceway R (Lvl 6), N64 Royal Raceway R/T (Lvl 8), RMX Choco Island 2, RMX Mario Circuit 1R/T, SNES Ghost Valley 1, SNES Rainbow Road R, SNES Rainbow Road T, Yoshi's Island
g_bright_ribbon;Bright Ribbon;HighEnd;3DS Neo Bowser City T, 3DS Rosalina's Ice World R/T, Amsterdam Drift 2, Amsterdam Drift T, DS Mario Circuit, DS Shroom Ridge R, GBA Bowser's Castle 3R/T, GBA Peach Circuit R/T, GBA Riverside Park (Lvl 8), GBA Riverside Park R, GBA Snow Land T, GBA Sunset Wilds R, GCN Baby Park (Lvl 6), GCN Baby Park R, GCN Baby Park R/T, GCN Daisy Cruiser T, GCN Dino Dino Jungle, GCN Mushroom Bridge T, GCN Yoshi Circuit (Lvl 3), Los Angeles Laps 2R, Madrid Drive 2T, Madrid Drive 3, N64 Frappe Snowland T, N64 Luigi Raceway R, N64 Mario Raceway R/T, N64 Royal Raceway R/T, N64 Yoshi Valley T (Lvl 6), New York Minute 2R, New York Minute R/T, Paris Promenade 2R, Paris Promenade 3R, Paris Promenade R/T, Piranha Plant Pipeline T, Sky-High Sundae R, SNES Bowser Castle 3R, SNES Donut Plains 2R, SNES Donut Plains 2R/T (Lvl 3), Sydney Sprint 2, Sydney Sprint 3, Sydney Sprint R, Tokyo Blur 2R, Vancouver Velocity R, Wii Coconut Mall, Wii Koopa Cape R, Wii Mushroom Gorge T, Yoshi's Island R/T
g_bullet_bill_hanafuda;Bullet Bill Hanafuda;HighEnd;3DS Rock Rock Mountain, 3DS Rock Rock Mountain R, 3DS Rock Rock Mountain T, DS Airship Fortress (Lvl 6), DS Waluigi Pinball (Lvl 3), DS Waluigi Pinball T (Lvl 3), N64 Frappe Snowland, N64 Frappe Snowland R, N64 Frappe Snowland R/T, N64 Frappe Snowland T, N64 Kalimari Desert 2T (Lvl 6), N64 Royal Raceway, N64 Royal Raceway R, N64 Royal Raceway R/T (Lvl 8), N64 Royal Raceway T
g_bullet_bill_parachute;Bullet Bill Parachute;HighEnd;3DS Daisy Hills R (Lvl 6), 3DS Mario Circuit R/T, 3DS Neo Bowser City R/T, 3DS Shy Guy Bazaar T (Lvl 6), DS Airship Fortress R, DS Airship Fortress T, DS DK Pass T, DS Twilight House, GBA Bowser's Castle 1, GCN Yoshi Circuit R, N64 Kalimari Desert T (Lvl 3), N64 Koopa Troopa Beach (Lvl 3), New York Minute 3R/T, New York Minute 4R, New York Minute 4R/T, RMX Rainbow Road 1R/T, SNES Choco Island 1R/T (Lvl 8), SNES Rainbow Road R
g_butterfly_prism;Butterfly Prism;HighEnd;3DS Rosalina's Ice World, Amsterdam Drift R/T, GBA Bowser's Castle 2, GBA Cheep-Cheep Island R (Lvl 8), GBA Sky Garden R, GBA Sunset Wilds (Lvl 6), GBA Sunset Wilds T, Merry Mountain (Lvl 3), N64 Choco Mountain R/T, N64 Frappe Snowland R/T (Lvl 6), Paris Promenade 2R, Paris Promenade 3, Paris Promenade 3T, RMX Choco Island 2, RMX Rainbow Road 1R/T, SNES Koopa Troopa Beach 2, SNES Koopa Troopa Beach 2R, SNES Mario Circuit 3, SNES Mario Circuit 3T, SNES Rainbow Road R (Lvl 3), SNES Vanilla Lake 1T, Tokyo Blur 4
g_butterfly_sunset;Butterfly Sunset;HighEnd;3DS Daisy Hills, 3DS Daisy Hills R (Lvl 3), 3DS Daisy Hills T (Lvl 3), 3DS Toad Circuit, 3DS Toad Circuit R, DS DK Pass R/T, GBA Bowser's Castle 2, London Loop 3R, N64 Kalimari Desert 2R, N64 Kalimari Desert R, N64 Kalimari Desert T, RMX Choco Island 1 (Lvl 8), RMX Choco Island 1R, RMX Rainbow Road 1 (Lvl 6), RMX Rainbow Road 1R, SNES Choco Island 1, SNES Koopa Troopa Beach 2 (Lvl 6), SNES Koopa Troopa Beach 2T, SNES Vanilla Lake 1R/T, Wii Maple Treeway
