ID;Name;Rarity;Top Shelf Courses
g_great_sail;Great Sail;HighEnd;3DS Daisy Hills T (Lvl 3), DS Airship Fortress, GCN Yoshi Circuit R/T (Lvl 3), Los Angeles Laps 2R, Los Angeles Laps R/T, N64 Frappe Snowland T, N64 Kalimari Desert 2, N64 Kalimari Desert 2T, N64 Royal Raceway, N64 Royal Raceway R (Lvl 6), RMX Rainbow Road 1, RMX Rainbow Road 1T (Lvl 6), SNES Choco Island 1R, SNES Koopa Troopa Beach 2R, SNES Koopa Troopa Beach 2T, Squeaky Clean Sprint R, Tokyo Blur 2, Tokyo Blur 2T, Wii DK Summit (Lvl 8)
g_green_cat_parafoil;Green Cat Parafoil;HighEnd;3DS Cheep Cheep Lagoon R/T, 3DS Cheep Cheep Lagoon T, 3DS Piranha Plant Slide R, 3DS Shy Guy Bazaar R, 3DS Toad Circuit T (Lvl 3), Bangkok Rush, Berlin Byways 2R, Berlin Byways 3T, Berlin Byways R, Berlin Byways T, DS Luigi's Mansion R/T (Lvl 3), DS Luigi's Mansion T, DS Peach Gardens R/T, DS Shroom Ridge R/T, GBA Boo Lake, GBA Bowser's Castle 4, GBA Luigi Circuit R/T, GBA Peach Circuit R/T, GCN Baby Park R (Lvl 8), GCN Baby Park T, GCN Dino Dino Jungle T, GCN DK Mountain, GCN DK Mountain R/T, GCN Yoshi Circuit R, GCN Yoshi Circuit T, N64 Luigi Raceway R, N64 Luigi Raceway R/T, N64 Yoshi Valley R, N64 Yoshi Valley T, New York Minute 2T, Paris Promenade 2R/T, Piranha Plant Pipeline R, RMX Bowser's Castle 1T, RMX Choco Island 1R/T (Lvl 6), RMX Donut Plains 1, RMX Donut Plains 1T, RMX Vanilla Lake 1R/T, Rome Avanti T, Singapore Speedway 3T, SNES Bowser Castle 3T, Tokyo Blur 3R, Vancouver Velocity 3, Wii Dry Dry Ruins T, Wii Koopa Cape, Wii Koopa Cape R/T, Wii Koopa Cape T (Lvl 6), Wii Moonview Highway T, Wii Rainbow Road
g_green_checkered_glider;Green Checkered Glider;HighEnd;3DS Piranha Plant Slide, Berlin Byways 2T, Berlin Byways 3, DS DK Pass R, DS Luigi's Mansion, DS Luigi's Mansion R, DS Luigi's Mansion R/T (Lvl 3), DS Shroom Ridge T (Lvl 8), GBA Luigi Circuit R, GBA Luigi Circuit T, GCN Baby Park R/T, London Loop 3R, Madrid Drive 2R, N64 Koopa Troopa Beach R/T, N64 Luigi Raceway R/T, N64 Royal Raceway R, New York Minute 3T, Paris Promenade T, Piranha Plant Cove 3R/T, Piranha Plant Cove 3T (Lvl 6), Piranha Plant Cove R, Piranha Plant Pipeline R, RMX Choco Island 1T, Rome Avanti 2, Singapore Speedway R, SNES Choco Island 2R, SNES Choco Island 2T (Lvl 3), SNES Ghost Valley 1R/T, SNES Ghost Valley 2, SNES Ghost Valley 2T (Lvl 6), SNES Koopa Troopa Beach 2R/T, SNES Vanilla Lake 2T, Squeaky Clean Sprint, Sydney Sprint R/T, Tokyo Blur 3R, Wii Coconut Mall, Wii Moonview Highway R/T
g_green_emblem;Green Emblem;HighEnd;3DS Cheep Cheep Lagoon, 3DS Piranha Plant Slide R/T, Athens Dash 3R/T, Bangkok Rush, Bangkok Rush 2R, Berlin Byways 2R, Berlin Byways 3, DS DK Pass T, GBA Luigi Circuit (Lvl 6), GBA Luigi Circuit R (Lvl 8), GBA Luigi Circuit T, GBA Sunset Wilds, GCN Dino Dino Jungle R, GCN Waluigi Stadium R, Los Angeles Laps 3R/T, Madrid Drive, Madrid Drive 3, N64 Koopa Troopa Beach R, N64 Luigi Raceway R/T, N64 Luigi Raceway T (Lvl 6), N64 Mario Raceway R/T, Paris Promenade 2T, Paris Promenade 3R/T, Paris Promenade T, Piranha Plant Pipeline R/T, RMX Vanilla Lake 2, Rome Avanti, Rome Avanti 3R, Singapore Speedway T, SNES Ghost Valley 1R (Lvl 3), SNES Ghost Valley 1T, SNES Koopa Troopa Beach 2R/T, SNES Mario Circuit 2R (Lvl 3), Sydney Sprint, Vancouver Velocity 2
g_green_sprout;Green Sprout;HighEnd;3DS Piranha Plant Slide T, Amsterdam Drift 2, Amsterdam Drift 2R/T, Amsterdam Drift 2T, Amsterdam Drift 3, Amsterdam Drift T, Bangkok Rush 3R, DS Shroom Ridge R, GBA Sky Garden R/T, GBA Sunset Wilds R/T (Lvl 6), GCN Baby Park, GCN Dino Dino Jungle, GCN Dino Dino Jungle T, GCN Yoshi Circuit, Madrid Drive, Madrid Drive R/T, Merry Mountain T, N64 Kalimari Desert 2, N64 Koopa Troopa Beach T, N64 Mario Raceway R/T, N64 Yoshi Valley, N64 Yoshi Valley R (Lvl 8), N64 Yoshi Valley T (Lvl 6), New York Minute 4T, New York Minute R, Ninja Hideaway T, Paris Promenade 2R/T, Paris Promenade 3R/T, Singapore Speedway, Singapore Speedway 3T, SNES Choco Island 1 (Lvl 3), SNES Choco Island 1R/T, SNES Choco Island 1T, SNES Donut Plains 1, SNES Donut Plains 1T, SNES Donut Plains 3, SNES Mario Circuit 2R/T, Wii Coconut Mall T, Wii Koopa Cape, Wii Maple Treeway R/T, Wii Maple Treeway T (Lvl 3)
g_heart_balloons;Heart Balloons;HighEnd;3DS Rainbow Road R/T, 3DS Toad Circuit R/T, DS Waluigi Pinball R, DS Waluigi Pinball R/T, GCN Yoshi Circuit T (Lvl 3), London Loop 2R, N64 Frappe Snowland (Lvl 6), N64 Frappe Snowland R, N64 Koopa Troopa Beach R/T, Paris Promenade, Paris Promenade 2R, Paris Promenade R, RMX Choco Island 1 (Lvl 6), RMX Choco Island 1T, RMX Choco Island 2R (Lvl 8), SNES Donut Plains 1T, SNES Rainbow Road R/T, SNES Rainbow Road T (Lvl 3), SNES Vanilla Lake 1, SNES Vanilla Lake 1T
g_home_field_glider;Home-Field Glider;HighEnd;3DS Daisy Hills R/T, 3DS Toad Circuit R/T, 3DS Toad Circuit T (Lvl 6), Amsterdam Drift, GBA Bowser's Castle 3T, GBA Cheep-Cheep Island, GBA Cheep-Cheep Island R, GBA Cheep-Cheep Island T (Lvl 3), GCN Daisy Cruiser R, London Loop 3R/T, Los Angeles Laps, Los Angeles Laps 2R/T, Los Angeles Laps 2T, Los Angeles Laps 3, Los Angeles Laps 3R, Los Angeles Laps 3R/T (Lvl 6), Los Angeles Laps T, N64 Koopa Troopa Beach R, New York Minute 4R/T, New York Minute 4T, New York Minute B, Piranha Plant Pipeline T, RMX Bowser's Castle 1, RMX Choco Island 2T, RMX Ghost Valley 1 (Lvl 8), SNES Choco Island 1R/T, SNES Choco Island 2, SNES Donut Plains 1T, SNES Koopa Troopa Beach 2, SNES Mario Circuit 1, SNES Mario Circuit 1R, SNES Mario Circuit 2R (Lvl 3), SNES Mario Circuit 2T, Sydney Sprint, Sydney Sprint 2R, Tokyo Blur 2R, Tokyo Blur 2T
g_icy_mario_s_mustache;Icy Mario's Mustache;HighEnd;3DS Mario Circuit, 3DS Piranha Plant Slide R, 3DS Piranha Plant Slide T, 3DS Rosalina's Ice World R/T (Lvl 6), Amsterdam Drift, Amsterdam Drift 2R, Amsterdam Drift 2R/T, Amsterdam Drift 3, DS Mario Circuit R, DS Shroom Ridge T, GBA Boo Lake R, GBA Boo Lake R/T, GBA Peach Circuit, GBA Riverside Park R, Madrid Drive 2R, Madrid Drive R, N64 Mario Raceway T, N64 Yoshi Valley R/T, Ninja Hideaway T, Piranha Plant Cove 2, Piranha Plant Pipeline, RMX Donut Plains 1R/T, RMX Ghost Valley 1R, RMX Rainbow Road 1R, RMX Rainbow Road 2T, RMX Vanilla Lake 1, RMX Vanilla Lake 1R (Lvl 3), RMX Vanilla Lake 1T (Lvl 6), RMX Vanilla Lake 2, Rome Avanti 3T, Singapore Speedway 2T, Singapore Speedway 3R/T, Singapore Speedway 3T, Singapore Speedway T, Sky-High Sundae R (Lvl 8), Sky-High Sundae R/T, Sky-High Sundae T, SNES Koopa Troopa Beach 2R/T, SNES Vanilla Lake 1R, SNES Vanilla Lake 1T (Lvl 3), Squeaky Clean Sprint R/T, Sydney Sprint R/T, Vancouver Velocity 2T, Vancouver Velocity 3R, Vancouver Velocity 3R/T, Vancouver Velocity R, Wii DK Summit, Wii DK Summit R/T, Wii Koopa Cape R/T, Wii Moonview Highway, Wii Mushroom Gorge R, Wii Rainbow Road
g_jellychute;Jellychute;HighEnd;3DS Rosalina's Ice World R/T, Amsterdam Drift 3T, Bangkok Rush 2, Bangkok Rush 3T, Bangkok Rush R, GBA Cheep-Cheep Island R/T (Lvl 8), GCN Daisy Cruiser R/T, GCN Daisy Cruiser T (Lvl 6), GCN Mushroom Bridge R, Los Angeles Laps 3R/T, Madrid Drive R/T, N64 Koopa Troopa Beach R, Piranha Plant Cove 3T, RMX Vanilla Lake 2R/T, SNES Koopa Troopa Beach 2, SNES Koopa Troopa Beach 2R/T (Lvl 6), SNES Koopa Troopa Beach 2T (Lvl 3), SNES Vanilla Lake 1, SNES Vanilla Lake 2R/T, Squeaky Clean Sprint R/T, Sydney Sprint 2R/T (Lvl 3), Sydney Sprint 2T, Sydney Sprint 3R/T, Tokyo Blur 3, Vancouver Velocity 3T, Wii Daisy Circuit R/T, Wii Moonview Highway T
g_jolly_bells;Jolly Bells;HighEnd;3DS Rainbow Road, 3DS Rainbow Road T, 3DS Rock Rock Mountain, 3DS Rosalina's Ice World R, Berlin Byways 2R/T, DS DK Pass, GBA Snow Land R, GCN Baby Park R, London Loop 3, Merry Mountain, Merry Mountain R (Lvl 6), N64 Frappe Snowland R (Lvl 3), N64 Frappe Snowland T (Lvl 3), N64 Kalimari Desert 2R/T (Lvl 8), N64 Royal Raceway R, N64 Royal Raceway T, RMX Choco Island 1T, RMX Rainbow Road 2, Rome Avanti 3R, SNES Rainbow Road R, SNES Rainbow Road T (Lvl 6), SNES Vanilla Lake 2R, Tokyo Blur 4T, Vancouver Velocity 2R/T, Wii DK Summit R/T
g_jumping_mario_hanafuda;Jumping Mario Hanafuda;HighEnd;3DS Rock Rock Mountain (Lvl 8), GBA Sunset Wilds R (Lvl 6), GBA Sunset Wilds T (Lvl 6), GCN Yoshi Circuit, GCN Yoshi Circuit R, GCN Yoshi Circuit T, N64 Choco Mountain, N64 Choco Mountain R, N64 Choco Mountain T, N64 Royal Raceway (Lvl 3), N64 Royal Raceway R (Lvl 3), Rome Avanti 3R/T, SNES Rainbow Road, SNES Rainbow Road R, SNES Rainbow Road T
g_lava_rocks;Lava Rocks;HighEnd;3DS Bowser's Castle R/T, 3DS Rosalina's Ice World, Athens Dash 2R/T, Athens Dash 3R/T, Athens Dash R/T, Bangkok Rush 2T, Bangkok Rush 3R/T, DS Airship Fortress R/T, GBA Bowser's Castle 1T (Lvl 6), GBA Bowser's Castle 3, GBA Bowser's Castle 3R (Lvl 8), GBA Bowser's Castle 3R/T, GBA Bowser's Castle 3T, GBA Lakeside Park, GBA Lakeside Park R/T, GBA Yoshi Desert T, GCN DK Mountain, GCN DK Mountain T, GCN Waluigi Stadium T, Madrid Drive 2T, N64 Choco Mountain R, N64 Choco Mountain R/T (Lvl 3), N64 Kalimari Desert, N64 Kalimari Desert 2R/T, N64 Kalimari Desert T, N64 Yoshi Valley, New York Minute 3, New York Minute 4T, New York Minute R/T, Piranha Plant Cove 2T, Piranha Plant Cove R, RMX Bowser's Castle 1, RMX Choco Island 1T, RMX Choco Island 2T, Singapore Speedway 2, Singapore Speedway 2R, Singapore Speedway 2R/T, SNES Bowser Castle 3, SNES Choco Island 1R/T (Lvl 6), SNES Choco Island 2R/T (Lvl 3), SNES Ghost Valley 2R, SNES Ghost Valley 2R/T, SNES Mario Circuit 1T, SNES Mario Circuit 2R, Wii Dry Dry Ruins, Wii Dry Dry Ruins R/T
g_le_tricolore;Le Tricolore;HighEnd;3DS Daisy Hills R/T, Athens Dash 3T, Berlin Byways 3R/T, GBA Bowser's Castle 2R, GBA Cheep-Cheep Island (Lvl 8), GBA Cheep-Cheep Island R, GCN Dino Dino Jungle R/T, GCN Yoshi Circuit R/T (Lvl 6), Madrid Drive 2T, Paris Promenade 2R/T, Paris Promenade 3R, Paris Promenade 3R/T, Paris Promenade B, Paris Promenade R, Paris Promenade T, SNES Choco Island 1R (Lvl 6), SNES Choco Island 2 (Lvl 3), SNES Mario Circuit 1R/T, SNES Mario Circuit 2R/T (Lvl 3), SNES Mario Circuit 3, SNES Mario Circuit 3R/T, SNES Rainbow Road R/T, SNES Rainbow Road T
g_lightning_oilpaper;Lightning Oilpaper;Super;3DS Cheep Cheep Lagoon T, 3DS Neo Bowser City R, 3DS Shy Guy Bazaar, Athens Dash 2R, Athens Dash 3R, DS Airship Fortress R, N64 Kalimari Desert, N64 Kalimari Desert R, Rome Avanti R/T, SNES Ghost Valley 1T, SNES Mario Circuit 2T, SNES Mario Circuit 3R (Lvl 6), SNES Rainbow Road T (Lvl 3)
g_luigi_golf_cap;Luigi Golf Cap;HighEnd;Berlin Byways (Lvl 6), Berlin Byways 2 (Lvl 3), Berlin Byways 3R/T, Berlin Byways R/T, DS DK Pass R, GBA Luigi Circuit R, GBA Luigi Circuit R/T, Los Angeles Laps 2R, Madrid Drive 2, Madrid Drive 3R, Madrid Drive R (Lvl 3), Madrid Drive R/T, N64 Frappe Snowland T, Piranha Plant Cove 3 (Lvl 6), Piranha Plant Cove 3R, Rome Avanti 3, SNES Vanilla Lake 2R/T, Sydney Sprint 3R, Wii Moonview Highway (Lvl 8), Wii Moonview Highway R/T
g_luigi_parafoil;Luigi Parafoil;HighEnd;3DS Toad Circuit R/T, 3DS Wario Shipyard R (Lvl 8), 3DS Wario Shipyard T, Amsterdam Drift T, Berlin Byways, Berlin Byways 3R/T, Berlin Byways 3T, DS Luigi's Mansion, DS Luigi's Mansion R, DS Luigi's Mansion R/T, DS Peach Gardens R/T, DS Peach Gardens T, DS Waluigi Pinball, GBA Bowser's Castle 4R, GBA Lakeside Park R, GBA Luigi Circuit R, GBA Sunset Wilds, GCN Baby Park R/T, Los Angeles Laps 2R/T, N64 Luigi Raceway, N64 Luigi Raceway R, N64 Yoshi Valley, New York Minute 2T, Paris Promenade, Paris Promenade T, Piranha Plant Cove 2R/T, RMX Bowser's Castle 1R/T, RMX Vanilla Lake 1 (Lvl 3), RMX Vanilla Lake 1R, RMX Vanilla Lake 1T (Lvl 6), Singapore Speedway 3R, Singapore Speedway 3T, Singapore Speedway R, Singapore Speedway T (Lvl 6), SNES Choco Island 2R/T, SNES Ghost Valley 2R/T, SNES Mario Circuit 1R (Lvl 3), SNES Mario Circuit 3T, SNES Vanilla Lake 2, Vancouver Velocity 2R, Vancouver Velocity 2T, Wii Coconut Mall T, Wii Mushroom Gorge, Wii Rainbow Road T
g_luigi_s_hat_balloon;Luigi's Hat Balloon;HighEnd;3DS Cheep Cheep Lagoon R, 3DS Wario Shipyard R, Amsterdam Drift 3T, Athens Dash R/T, Berlin Byways 3R, Berlin Byways R, DS DK Pass, DS DK Pass R (Lvl 3), DS Luigi's Mansion R/T, DS Peach Gardens R/T, DS Shroom Ridge R/T, GBA Battle Course 1, GBA Bowser's Castle 3 (Lvl 6), GBA Cheep-Cheep Island R, GBA Cheep-Cheep Island R/T, GBA Luigi Circuit R, GBA Luigi Circuit T, GBA Snow Land, GCN Baby Park T, GCN DK Mountain, London Loop R/T, Los Angeles Laps R/T, Madrid Drive T, N64 Luigi Raceway (Lvl 6), N64 Luigi Raceway R, Piranha Plant Cove 2R/T, Piranha Plant Cove 3T, RMX Bowser's Castle 1R (Lvl 3), RMX Donut Plains 1R, Singapore Speedway 3R, Singapore Speedway 3R/T, Singapore Speedway R/T, SNES Bowser Castle 3T, SNES Donut Plains 1R/T, SNES Donut Plains 3, SNES Ghost Valley 2, SNES Ghost Valley 2T (Lvl 8), Squeaky Clean Sprint R/T, Sydney Sprint 2, Vancouver Velocity 3, Vancouver Velocity 3T, Wii Daisy Circuit R/T, Wii Dry Dry Ruins, Wii Moonview Highway R/T, Yoshi's Island R/T, Yoshi's Island T
g_luigi_s_mustache;Luigi's Mustache;HighEnd;3DS Bowser's Castle (Lvl 6), 3DS Shy Guy Bazaar R/T, Amsterdam Drift R, Bangkok Rush 2T, Bangkok Rush 3R/T, Berlin Byways T, DS Luigi's Mansion R, DS Luigi's Mansion T, DS Shroom Ridge T, DS Waluigi Pinball R, GBA Bowser's Castle 4R, GBA Cheep-Cheep Island T, GBA Luigi Circuit R/T, N64 Kalimari Desert 2 (Lvl 3), N64 Luigi Raceway, N64 Luigi Raceway R/T, N64 Luigi Raceway T, N64 Yoshi Valley T, New York Minute 2R, New York Minute 4R, Paris Promenade 2T, Paris Promenade 3, Piranha Plant Cove R, Piranha Plant Pipeline T, RMX Donut Plains 1R/T, RMX Ghost Valley 1 (Lvl 3), RMX Ghost Valley 1T, Rome Avanti 2R, Singapore Speedway 3R, SNES Bowser Castle 3R, SNES Donut Plains 2T, SNES Ghost Valley 1R, SNES Ghost Valley 1T, SNES Vanilla Lake 2T (Lvl 6), Sydney Sprint, Vancouver Velocity 3T, Wii Coconut Mall R, Wii Daisy Circuit, Wii DK Summit R/T, Wii Koopa Cape R, Wii Mushroom Gorge (Lvl 8), Wii Mushroom Gorge T, Wii Rainbow Road, Yoshi's Island R/T
g_luma_parafoil;Luma Parafoil;HighEnd;3DS Mario Circuit T, 3DS Neo Bowser City, 3DS Neo Bowser City T (Lvl 3), 3DS Rainbow Road R/T (Lvl 3), 3DS Rosalina's Ice World (Lvl 8), 3DS Rosalina's Ice World T, 3DS Shy Guy Bazaar (Lvl 6), 3DS Shy Guy Bazaar R, DS DK Pass R/T, London Loop R, Los Angeles Laps T, N64 Frappe Snowland, N64 Frappe Snowland R, RMX Mario Circuit 1 (Lvl 6), Rome Avanti 3R/T, SNES Koopa Troopa Beach 2, SNES Mario Circuit 1R, SNES Rainbow Road R/T, Vancouver Velocity, Vancouver Velocity 3R/T, Vancouver Velocity T
g_magic_parasol;Magic Parasol;HighEnd;3DS Bowser's Castle, 3DS Neo Bowser City T, 3DS Shy Guy Bazaar R (Lvl 6), 3DS Wario Shipyard (Lvl 8), 3DS Wario Shipyard R, Amsterdam Drift, DS Airship Fortress, DS Luigi's Mansion R/T, DS Waluigi Pinball R, GBA Boo Lake R/T, GBA Bowser's Castle 1R/T, GBA Bowser's Castle 2T, GBA Sky Garden T, GBA Sunset Wilds T, London Loop 2T, London Loop 3 (Lvl 6), London Loop 3R, London Loop 3R/T, Los Angeles Laps 2T, Merry Mountain R/T, N64 Choco Mountain, RMX Ghost Valley 1, RMX Ghost Valley 1T (Lvl 3), RMX Rainbow Road 1T, RMX Rainbow Road 2R/T, Singapore Speedway R/T, SNES Ghost Valley 1R/T, SNES Koopa Troopa Beach 2R/T, SNES Rainbow Road T (Lvl 3), Vancouver Velocity 2R, Wii Coconut Mall R/T, Wii Maple Treeway, Wii Maple Treeway R/T
g_magniflying_glass;Magniflying Glass;HighEnd;3DS Cheep Cheep Lagoon R, 3DS Daisy Hills, 3DS Daisy Hills R (Lvl 3), 3DS Neo Bowser City R, 3DS Piranha Plant Slide, 3DS Shy Guy Bazaar (Lvl 3), 3DS Toad Circuit, 3DS Toad Circuit R, Amsterdam Drift, Amsterdam Drift T, Athens Dash 2R, Bangkok Rush 3T, Berlin Byways R, DS Mario Circuit R/T, DS Mario Circuit T, DS Waluigi Pinball R/T, GBA Boo Lake T, GBA Bowser's Castle 3R, GBA Cheep-Cheep Island (Lvl 6), GBA Cheep-Cheep Island R, GBA Luigi Circuit R/T, GBA Snow Land R, GCN Baby Park, GCN Mushroom Bridge R, N64 Royal Raceway (Lvl 6), New York Minute 2, Piranha Plant Cove, Piranha Plant Cove 2R/T, Piranha Plant Cove 3R, Piranha Plant Pipeline, RMX Donut Plains 1R/T, Rome Avanti, Singapore Speedway 3T, Squeaky Clean Sprint R, Sydney Sprint 3, Tokyo Blur 2R, Vancouver Velocity 3R/T, Wii Coconut Mall, Wii Coconut Mall R (Lvl 8), Wii Coconut Mall R/T, Wii Rainbow Road T
g_manta_glider;Manta Glider;HighEnd;3DS Cheep Cheep Lagoon, 3DS Cheep Cheep Lagoon R (Lvl 3), 3DS Cheep Cheep Lagoon R/T, 3DS Cheep Cheep Lagoon T, 3DS Rosalina's Ice World, 3DS Rosalina's Ice World R, 3DS Rosalina's Ice World T (Lvl 8), DS Airship Fortress, DS Airship Fortress R, DS Airship Fortress T (Lvl 6), DS DK Pass R, GBA Luigi Circuit R, Los Angeles Laps, Los Angeles Laps R, N64 Koopa Troopa Beach T (Lvl 3), N64 Royal Raceway (Lvl 6), RMX Ghost Valley 1R, RMX Ghost Valley 1R/T, RMX Mario Circuit 1T, RMX Vanilla Lake 1T, SNES Koopa Troopa Beach 2R, SNES Koopa Troopa Beach 2T, SNES Rainbow Road R/T, SNES Vanilla Lake 1R, SNES Vanilla Lake 1R/T, Sydney Sprint 2T
g_mario_bros_parafoil;Mario Bros. Parafoil;HighEnd;3DS Piranha Plant Slide R, Amsterdam Drift 3R, Athens Dash T, DS DK Pass T, GBA Bowser's Castle 4, GBA Lakeside Park T, GBA Luigi Circuit T, GBA Peach Circuit R/T, GCN Daisy Cruiser T, GCN Mushroom Bridge T, GCN Waluigi Stadium, GCN Waluigi Stadium R (Lvl 6), London Loop 3, Madrid Drive 2R, Madrid Drive T, New York Minute, New York Minute 2 (Lvl 3), New York Minute 2R (Lvl 3), New York Minute 3T, Piranha Plant Cove T, Piranha Plant Pipeline R, Piranha Plant Pipeline R/T, Piranha Plant Pipeline T, RMX Vanilla Lake 2T, Rome Avanti R/T, SNES Koopa Troopa Beach 2T, Sydney Sprint, Tokyo Blur 2R/T, Tokyo Blur 3, Wii DK Summit R/T, Wii Moonview Highway (Lvl 8), Wii Moonview Highway R, Wii Moonview Highway T (Lvl 6)
g_mario_golf_cap;Mario Golf Cap;HighEnd;Berlin Byways 3R/T, Berlin Byways R, DS DK Pass R/T, Madrid Drive (Lvl 6), Madrid Drive 2R/T, Madrid Drive 3T, N64 Frappe Snowland, Paris Promenade 3 (Lvl 3), Paris Promenade 3T, Piranha Plant Cove 3, Piranha Plant Cove 3R/T (Lvl 8), RMX Vanilla Lake 1R, RMX Vanilla Lake 2R, Rome Avanti 3R, Tokyo Blur, Tokyo Blur R/T (Lvl 3), Wii Moonview Highway R (Lvl 6)
g_mario_s_hat_balloon;Mario's Hat Balloon;HighEnd;3DS Bowser's Castle R/T (Lvl 3), 3DS Mario Circuit R, 3DS Piranha Plant Slide (Lvl 6), 3DS Piranha Plant Slide R/T, 3DS Piranha Plant Slide T, Amsterdam Drift T, Athens Dash, Athens Dash 3R/T, Bangkok Rush 2R, Bangkok Rush 3T, DS Mario Circuit T, DS Peach Gardens R, DS Shroom Ridge, GBA Battle Course 1, GBA Bowser's Castle 3 (Lvl 8), GBA Bowser's Castle 4, GBA Cheep-Cheep Island, GBA Peach Circuit R/T, GBA Riverside Park T, GBA Snow Land R/T, GCN Daisy Cruiser (Lvl 6), GCN Daisy Cruiser R, GCN Mushroom Bridge R, London Loop, Los Angeles Laps 3, Los Angeles Laps 3R/T, Madrid Drive 2T, N64 Mario Raceway R, N64 Mario Raceway T, New York Minute 3R/T, New York Minute R, New York Minute R/T, New York Minute T, Paris Promenade R, Singapore Speedway 2R, Sky-High Sundae T, SNES Choco Island 1R, SNES Donut Plains 1R, SNES Donut Plains 3R, SNES Donut Plains 3T, SNES Ghost Valley 2R, SNES Mario Circuit 1R/T, Sydney Sprint 3T, Tokyo Blur 4T, Wii Coconut Mall T, Wii Dry Dry Ruins T, Wii Mushroom Gorge (Lvl 3), Wii Mushroom Gorge R, Wii Rainbow Road, Yoshi's Island T
g_mario_s_mustache;Mario's Mustache;HighEnd;3DS Mario Circuit, 3DS Mario Circuit T, 3DS Wario Shipyard, Amsterdam Drift, Bangkok Rush 2, Berlin Byways, Berlin Byways 3, Berlin Byways 3T, DS Airship Fortress R/T (Lvl 6), DS Shroom Ridge T, GBA Battle Course 1, GBA Cheep-Cheep Island, GBA Sky Garden, GBA Sky Garden R, GBA Sky Garden T (Lvl 6), London Loop 2R/T, London Loop 3T, New York Minute 3R/T, New York Minute 4, New York Minute T, Ninja Hideaway R/T, Piranha Plant Cove 2R/T, Piranha Plant Cove 3T, Piranha Plant Pipeline, RMX Bowser's Castle 1R/T, RMX Choco Island 2, RMX Mario Circuit 1T (Lvl 3), Rome Avanti 3T, Singapore Speedway 2R/T, Sky-High Sundae R/T, SNES Choco Island 1R, SNES Choco Island 1R/T (Lvl 3), SNES Donut Plains 3T, SNES Mario Circuit 1R/T, SNES Mario Circuit 2R/T, SNES Mario Circuit 3R/T, Squeaky Clean Sprint R/T, Sydney Sprint 2R/T, Sydney Sprint 3R/T, Wii Coconut Mall, Wii Koopa Cape, Wii Moonview Highway R/T, Wii Mushroom Gorge, Wii Mushroom Gorge T (Lvl 8), Wii Rainbow Road R, Yoshi's Island T
g_melon_banana_balloons;Melon & Banana Balloons;HighEnd;Amsterdam Drift 3T, DS DK Pass (Lvl 3), DS DK Pass R, GBA Luigi Circuit (Lvl 6), Madrid Drive 3R/T, RMX Vanilla Lake 2R/T, Rome Avanti 3T, Sky-High Sundae (Lvl 6), Sky-High Sundae R/T, SNES Vanilla Lake 2R/T (Lvl 8), Sydney Sprint 3R/T, Wii DK Summit (Lvl 3), Wii DK Summit R
g_meteor_balloons;Meteor Balloons;HighEnd;3DS Bowser's Castle (Lvl 8), 3DS Rainbow Road R (Lvl 3), 3DS Rainbow Road R/T, 3DS Rainbow Road T (Lvl 6), 3DS Rock Rock Mountain R, 3DS Wario Shipyard T, Amsterdam Drift 2, Amsterdam Drift R/T, DS Twilight House, GBA Lakeside Park T, GBA Sky Garden, N64 Choco Mountain R/T, N64 Choco Mountain T (Lvl 3), N64 Kalimari Desert, N64 Kalimari Desert 2R, N64 Yoshi Valley T, RMX Rainbow Road 2R/T, RMX Vanilla Lake 1, RMX Vanilla Lake 1R (Lvl 6), RMX Vanilla Lake 1T, SNES Bowser Castle 3R, SNES Vanilla Lake 2, SNES Vanilla Lake 2R, Vancouver Velocity 2R/T, Wii Coconut Mall R, Wii Mushroom Gorge
g_minion_paper_glider;Minion Paper Glider;Normal;DS DK Pass R, DS DK Pass T, GCN Dino Dino Jungle (Lvl 6), N64 Mario Raceway
g_mint_berry_balloons;Mint & Berry Balloons;HighEnd;3DS Cheep Cheep Lagoon T, 3DS Daisy Hills, 3DS Daisy Hills R/T, 3DS Mario Circuit R, 3DS Piranha Plant Slide T, Amsterdam Drift R/T, Bangkok Rush, Bangkok Rush 2R/T, Berlin Byways R/T, DS Peach Gardens R, DS Peach Gardens R/T, GBA Riverside Park R/T, GBA Snow Land T, GCN Baby Park (Lvl 8), GCN Daisy Cruiser R, Madrid Drive R, N64 Luigi Raceway T, N64 Mario Raceway R, New York Minute 3R, Paris Promenade 3, Paris Promenade R/T, RMX Choco Island 1R/T, RMX Choco Island 1T, RMX Donut Plains 1, RMX Vanilla Lake 1R, RMX Vanilla Lake 1T (Lvl 3), Rome Avanti 2R/T, Rome Avanti R/T, Sky-High Sundae, Sky-High Sundae R, Sky-High Sundae R/T (Lvl 6), SNES Choco Island 2R/T, SNES Donut Plains 3R/T, SNES Donut Plains 3T, SNES Vanilla Lake 1R (Lvl 3), Sydney Sprint 2R, Sydney Sprint 3, Sydney Sprint 3T, Tokyo Blur 2R/T, Tokyo Blur 4T, Vancouver Velocity 3, Vancouver Velocity 3R, Wii Coconut Mall (Lvl 6), Wii Koopa Cape T, Wii Mushroom Gorge, Wii Mushroom Gorge R/T, Wii Rainbow Road R, Yoshi's Island
g_mosaic_starchute;Mosaic Starchute;HighEnd;Amsterdam Drift 3T, Athens Dash 3, Athens Dash 3R/T, GBA Lakeside Park R/T, GBA Peach Circuit R/T, GBA Sunset Wilds R/T, GBA Sunset Wilds T (Lvl 3), GBA Yoshi Desert R/T, GBA Yoshi Desert T (Lvl 6), GCN Baby Park T, Madrid Drive 2T, Madrid Drive 3T, Madrid Drive R, N64 Kalimari Desert 2R/T (Lvl 3), Paris Promenade 2R/T, Paris Promenade 3R/T, Piranha Plant Cove 2, Piranha Plant Cove 2T, Piranha Plant Pipeline, RMX Vanilla Lake 1R/T, RMX Vanilla Lake 2R/T, RMX Vanilla Lake 2T, Sky-High Sundae T, Squeaky Clean Sprint R/T, Sydney Sprint 2R/T, Sydney Sprint T, Tokyo Blur 2, Tokyo Blur 3R, Wii Daisy Circuit T, Wii Dry Dry Ruins, Wii Dry Dry Ruins R/T (Lvl 8), Wii Dry Dry Ruins T (Lvl 6)
g_mushroom_glider;Mushroom Glider;Super;3DS Mario Circuit R/T, 3DS Mario Circuit T, 3DS Shy Guy Bazaar T, 3DS Toad Circuit R (Lvl 3), 3DS Toad Circuit T, DS Mario Circuit R/T, GCN Yoshi Circuit, Paris Promenade 3R, RMX Mario Circuit 1R (Lvl 6), SNES Mario Circuit 1, SNES Mario Circuit 3R, Squeaky Clean Sprint R, Sydney Sprint R, Wii DK Summit T
g_nabbit_oilpaper_umbrella;Nabbit Oilpaper Umbrella;HighEnd;3DS Neo Bowser City R, 3DS Neo Bowser City T (Lvl 3), 3DS Shy Guy Bazaar, Athens Dash 3, Athens Dash R/T, Athens Dash T, Bangkok Rush, DS Airship Fortress T (Lvl 6), DS Luigi's Mansion R/T, DS Mario Circuit R, DS Twilight House, GBA Bowser's Castle 1, GBA Bowser's Castle 1T, GBA Lakeside Park R, GBA Luigi Circuit, GCN Daisy Cruiser T, London Loop 2T, Madrid Drive, N64 Choco Mountain, N64 Choco Mountain R, N64 Choco Mountain T, N64 Kalimari Desert 2 (Lvl 6), N64 Kalimari Desert 2R/T (Lvl 8), N64 Yoshi Valley T, Ninja Hideaway T, Paris Promenade 2R/T, Piranha Plant Cove, Piranha Plant Cove R, Piranha Plant Cove T, RMX Choco Island 2R/T, RMX Choco Island 2T, RMX Ghost Valley 1, RMX Ghost Valley 1R/T, Singapore Speedway 2R/T, Sky-High Sundae T, SNES Choco Island 1R/T, SNES Choco Island 2, SNES Donut Plains 1R, SNES Ghost Valley 2, SNES Mario Circuit 1T (Lvl 3), SNES Vanilla Lake 1R/T, Tokyo Blur 3R, Tokyo Blur 3T, Tokyo Blur T, Wii DK Summit T
g_nabbit_parachute;Nabbit Parachute;HighEnd;3DS Bowser's Castle, 3DS Cheep Cheep Lagoon T, 3DS Mario Circuit R/T, 3DS Neo Bowser City, 3DS Shy Guy Bazaar T, Amsterdam Drift 2, Athens Dash 2R, Athens Dash 3R/T, Bangkok Rush 2R/T, DS DK Pass R, DS Peach Gardens, DS Peach Gardens R, DS Peach Gardens T (Lvl 6), DS Waluigi Pinball, GBA Boo Lake R/T, GBA Bowser's Castle 2R/T, GBA Yoshi Desert, GCN Daisy Cruiser, GCN DK Mountain (Lvl 8), GCN DK Mountain R, GCN Mushroom Bridge, GCN Waluigi Stadium R, London Loop R, Madrid Drive 3, N64 Frappe Snowland R/T, N64 Kalimari Desert 2R/T, N64 Mario Raceway, Ninja Hideaway R, Paris Promenade 2T, Paris Promenade 3T, Piranha Plant Cove 3R/T, Piranha Plant Cove T, RMX Bowser's Castle 1R (Lvl 6), RMX Choco Island 2, RMX Choco Island 2R (Lvl 3), RMX Donut Plains 1R, RMX Vanilla Lake 1R/T, Rome Avanti 2, Singapore Speedway 3R, SNES Donut Plains 1T, SNES Donut Plains 2R/T, SNES Donut Plains 3, SNES Donut Plains 3R/T, SNES Ghost Valley 2T, Sydney Sprint 2R/T, Sydney Sprint T, Tokyo Blur 2, Vancouver Velocity, Wii Coconut Mall R (Lvl 3), Wii Coconut Mall R/T, Wii Dry Dry Ruins R, Wii Moonview Highway R
